id,ticker,stock_name
1,A,"Agilent Technologies, Inc. Common Stock"
2,AA,Alcoa Inc. Common Stock
3,AA-B,Alcoa Inc. Depository Shares Representing 1/10th Preferred Convertilble Class B Series 1
4,AAC,"AAC Holdings, Inc. Common Stock"
5,AAN,"Aaron's, Inc. Common Stock"
6,AAP,Advance Auto Parts Inc Advance Auto Parts Inc W/I
7,AAT,"American Assets Trust, Inc. Common Stock"
8,AAV,Advantage Oil & Gas Ltd  Ordinary Shares
9,AB,Allianceberstein Holding L.P.  Units
10,ABB,ABB Ltd Common Stock
11,ABBV,AbbVie Inc. Common Stock
12,ABC,AmerisourceBergen Corporation (Holding Co) Common Stock
13,ABEV,Ambev S.A. American Depositary Shares (Each representing 1 Common Share)
14,ABG,Asbury Automotive Group Inc Common Stock
15,ABM,ABM Industries Incorporated Common Stock
16,ABR,Arbor Realty Trust Common Stock
17,ABR-A,Arbor Realty Trust Preferred Series A
18,ABR-B,Arbor Realty Trust Cumulative Redeemable Preferred Series B
19,ABR-C,Arbor Realty Trust Cumulative Redeemable Preferred Series C
20,ABRN,Arbor Realty Trust 7.375% Senior Notes due 2021
21,ABT,Abbott Laboratories Common Stock
22,ABX,Barrick Gold Corporation Common Stock
23,ACC,American Campus Communities Inc Common Stock
24,ACCO,Acco Brands Corporation Common Stock
25,ACE,Ace Limited Common Stock
26,ACG,Alliancebernstein Income Fund
27,ACH,Aluminum Corporation of China Limited American Depositary Shares
28,ACI,"Arch Coal, Inc. Common Stock"
29,ACM,AECOM Common Stock
30,ACMP,"Access Midstream Partners, L.P. Common Units Representing Limited Partner Interests"
31,ACN,Accenture plc. Class A Ordinary Shares (Ireland)
32,ACP,Avenue Income Credit Strategies Fund Common Shares
33,ACRE,Ares Commercial Real Estate Corporation Common Stock
34,ACT,Actavis plc Ordinary Shares
35,ACW,Accuride Corporation Common Stock
36,ADC,Agree Realty Corporation Common Stock
37,ADM,Archer
38,ADPT,Adeptus Health Inc. Common Stock
39,ADS,Alliance Data Systems Corporation Common Stock
40,ADT,ADT Corporation Common Stock
41,ADX,Adams Express Company (The)
42,AEB,AEGON N.V. Perp. Cap. Secs. Floating Rate (Netherlands)
43,AEC,Associated Estates Realty Corporation Common Stock
44,AED,AEGON N.V. Perp. Cap. Securities (Netherlands)
45,AEE,Ameren Corporation Common Stock
46,AEG,AEGON N.V. Common Stock
47,AEH,AEGON N.V. Perp. Cap Secs.
48,AEK,Aegon NV 8.00% Non
49,AEL,American Equity Investment Life Holding Company Common Stock
50,AEM,Agnico Eagle Mines Limited Common Stock
51,AEO,"American Eagle Outfitters, Inc. Common Stock"
52,AEP,"American Electric Power Company, Inc. Common Stock"
53,AER,Aercap Holdings N.V. Ordinary Shares
54,AES,The AES Corporation Common Stock
55,AES-C,AES Corporation (The) Class C Preferred Stock
56,AET,Aetna Inc. Common Stock
57,AF,Astoria Financial Corporation Common Stock
58,AF-C,Astoria Financial Corporation Depositary Shs Repstg 1/40th Int Perp Pfd Ser C 6.5%
59,AFA,"American Financial Group, Inc. 5.75% Senior Notes due 2042"
60,AFB,AllianceBernstein National Municipal Income Fund Inc
61,AFC,"Allied Capital Corporation Allied Capital Corporation 6.875% Notes due April 15, 2047"
62,AFG,"American Financial Group, Inc. Common Stock"
63,AFGE,"American Financial Group, Inc. 6.25% Subordinated Debentures due 2054"
64,AFL,AFLAC Incorporated Common Stock
65,AFM,"Affiliated Managers Group, Inc. 5.250% Senior Notes due 2022"
66,AFQ,"American Financial Group, Inc. 7% Senior Notes due 2050"
67,AFSD,"Aflac Incorporated 5.50% Subordinated Debentures due September 15, 2052"
68,AFSI-A,"AmTrust Financial Services, Inc. Preferred Series A"
69,AFSI-B,"AmTrust Financial Services, Inc. Depository Shares Representing 1/40th Preferred Series B"
70,AFSI-C,"AmTrust Financial Services, Inc. Depository Shares Representing 1/40th Preferred Series C"
71,AFT,Apollo Senior Floating Rate Fund Inc. Common Stock
72,AFW,"American Financial Group, Inc. 6 3/8% Senior Notes due 2042"
73,AG,First Majestic Silver Corp. Ordinary Shares (Canada)
74,AGC,Advent Claymore Convertible Securities and Income Fund Common Shares of Beneficial Interest
75,AGCO,AGCO Corporation Common Stock
76,AGD,Alpine Global Dynamic Dividend Fund Shares of Beneficial Interest
77,AGI,Alamos Gold Inc Ordinary Shares
78,AGM,Federal Agricultural Mortgage Corporation Common Stock
79,AGM-A,Federal Agricultural Mortgage Corporation 5.875% Non
80,AGM-B,Federal Agricultural Mortgage Corporation Non Cumulative Preferred Stock Series B
81,AGM-C,Federal Agricultural Mortgage Corporation Preferred Series C Fixed to Fltg
82,AGM.A,Federal Agricultural Mortgage Corporation Common Stock
83,AGN,"Allergan, Inc. Common Stock"
84,AGO,Assured Guaranty Ltd. Common Stock
85,AGO-B,Assured Guaranty Ltd.
86,AGO-E,Assured Guaranty Ltd.
87,AGO-F,Assured Guaranty Ltd.
88,AGRO,Adecoagro S.A. Common Shares
89,AGU,Agrium Inc. Common Stock
90,AGX,"Argan, Inc. Common Stock"
91,AHC,A.H. Belo Corporation Common Stock
92,AHH,"Armada Hoffler Properties, Inc. Common Stock"
93,AHL,Aspen Insurance Holdings Limited Ordinary Shares
94,AHL-A,Aspen Insurance Holdings Limited Perp Pfd Shares (Bermuda)
95,AHL-B,Aspen Insurance Holdings Limited Perp Pref Shs (Bermuda)
96,AHL-C,Aspen Insurance Holdings Limited 5.95% Fixed
97,AHP,"Ashford Hospitality Prime, Inc. Common Stock"
98,AHS,AMN Healthcare Services Inc AMN Healthcare Services Inc
99,AHT,Ashford Hospitality Trust Inc Common Stock
100,AHT-A,Ashford Hospitality Trust Inc 8.55% Cum Preferred Series A
101,AHT-D,Ashford Hospitality Trust Inc 8.45% Series D Cumulative Preferred Stock
102,AHT-E,Ashford Hospitality Trust Inc 9.00% Series E Cumulative Preferred Stock
103,AI,Arlington Asset Investment Corp Class A (new)
104,AIB,Apollo Investment Corporation 6.625% Senior Notes due 2042
105,AIF,Apollo Tactical Income Fund Inc. Common Stock
106,AIG,"American International Group, Inc. New Common Stock"
107,AIG.W,"American International Group, Inc. Warrant expiring January 19, 2021"
108,AIN,Albany International Corporation Common Stock
109,AIR,AAR Corp. Common Stock
110,AIT,"Applied Industrial Technologies, Inc. Common Stock"
111,AIV,Apartment Investment and Management Company Common Stock
112,AIV-A,Apartment Investment and Management Company Preferred Series Class A
113,AIV-Z,Apartment Investment and Management Company Class Z Cumulative Preferred Stock
114,AIW,Arlington Asset Investment Corp 6.625% Notes due 2023
115,AIY,Apollo Investment Corporation 6.875% Senior Notes due 2043
116,AIZ,"Assurant, Inc. Common Stock"
117,AJG,Arthur J. Gallagher & Co. Common Stock
118,AKO.A,Embotelladora Andina S.A. Common Stock
119,AKO.B,Embotelladora Andina S.A. Common Stock
120,AKP,Alliance California Municipal Income Fund Inc
121,AKR,Acadia Realty Trust Common Stock
122,AKS,AK Steel Holding Corporation Common Stock
123,AL,Air Lease Corporation Class A Common Stock
124,ALB,Albemarle Corporation Common Stock
125,ALDW,"Alon USA Partners, LP Common Units representing Limited Partner Interests"
126,ALE,"Allete, Inc."
127,ALEX,"Alexander & Baldwin, Inc. Common Stock"
128,ALG,"Alamo Group, Inc. Common Stock"
129,ALJ,"Alon USA Energy, Inc. common stick"
130,ALK,"Alaska Air Group, Inc. Common Stock"
131,ALL,Allstate Corporation (The) Common Stock
132,ALL-A,Allstate Corporation (The) Dep Shs Repstg 1/1000th Perp Pfd Ser A
133,ALL-B,Allstate Corporation (The) 5.100% Fixed
134,ALL-C,Allstate Corporation (The) Dep Shs Repstg 1/1000th Int Shs Pfd Stk Ser C
135,ALL-D,The Allstate Corporation Leopards Each Representing A 1/1000th Interest In A Share Of Fixed Rate Noncumulative Perpetual Preferred Stock Series D
136,ALL-E,Allstate Corporation Depositary Shares Representing 1/1000th Perpetual Preferred Series E
137,ALL-F,Allstate Corporation (The) Leopards Dep Shares Representing 1/1000th Perp Pfd
138,ALLE,Allegion plc Ordinary Shares
139,ALLY,Ally Financial Inc. Common Stock
140,ALLY-A,"GMAC Capital Trust I Fixed Rate Floating Rate Trust Preferred Securities, Series 2"
141,ALLY-B,"Ally Financial Inc Fixed Rate Floating Rate Perpetual Preferred Stock, Series A"
142,ALP-N,Alabama Power Company Preferred Stock
143,ALP-O,Alabama Power Company Preferred Stock
144,ALP-P,Alabama Power Company 5.30% Cl A Pfd Stk
145,ALR,Alere Inc. Common Stock
146,ALR-B,"Alere Inc. Inverness Medical Innovations, Inc. Series B Convertible Perpetual Preferred Stock"
147,ALSN,"Allison Transmission Holdings, Inc. Common Stock"
148,ALU,Alcatel
149,ALV,"Autoliv, Inc. Common Stock"
150,ALX,"Alexander's, Inc. Common Stock"
151,AM,Antero Midstream Partners LP Common Units representing limited partner interests
152,AMBR,"Amber Road, Inc. Common Stock"
153,AMC,"AMC Entertainment Holdings, Inc. Class A Common Stock"
154,AME,"AMETEK, Inc."
155,AMFW,AMEC Foster Wheeler plc American Depositary Shares
156,AMG,"Affiliated Managers Group, Inc. Common Stock"
157,AMH,American Homes 4 Rent Common Shares of Beneficial Interest
158,AMH-A,American Homes 4 Rent Participating Preferred Shares Series A
159,AMH-B,American Homes 4 Rent 5% Series B Participating Preferred Shares of Beneficial Interest
160,AMH-C,American Homes 4 Rent Participating Pfd Ser C
161,AMID,"American Midstream Partners, LP Common Units representing Limited Partner Interests"
162,AMP,"Ameriprise Financial, Inc. Common Stock"
163,AMRC,"Ameresco, Inc. Class A Common Stock"
164,AMRE,"AmREIT, Inc. Common stock"
165,AMT,American Tower Corporation (REIT) Common Stock
166,AMT-A,American Tower Corporation (REIT) Pfd Conv Ser A
167,AMTD,TD Ameritrade Holding Corporation Common Stock
168,AMTG,"Apollo Residential Mortgage, Inc. Common Stock"
169,AMTG-A,"Apollo Residential Mortgage, Inc. Pfd Shs Series A  (US)"
170,AMX,"America Movil, S.A.B. de C.V. American Depository Receipt Series L"
171,AN,"AutoNation, Inc. Common Stock"
172,ANET,"Arista Networks, Inc. Common Stock"
173,ANF,Abercrombie & Fitch Company Common Stock
174,ANFI,Amira Nature Foods Ltd Ordinary Shares
175,ANH,Anworth Mortgage Asset Corporation Common Stock
176,ANH-A,Anworth Mortgage Asset Corporation Series A Preferred Stock
177,ANH-B,Anworth Mortgage Asset  Corporation Preferred Stock Series B 6.25%
178,ANN,ANN INC. Common Stock
179,ANR,"Alpha Natural Resources, inc. comm stock"
180,ANTM,"Anthem, Inc. Common Stock"
181,ANW,Aegean Marine Petroleum Network Inc. Common Stock
182,AOD,Alpine Total Dynamic Dividend Fund Common Stock
183,AOI,"Alliance One International, Inc. Common Stock"
184,AOL,AOL Inc. AOL Inc. Common Stock
185,AON,Aon plc Class A Ordinary Shares (UK)
186,AOS,A.O. Smith Corporation Common Stock
187,AP,Ampco
188,APA,Apache Corporation Common Stock
189,APAM,Artisan Partners Asset Management Inc. Class A Common Stock
190,APB,"Asia Pacific Fund, Inc. (The)"
191,APC,Anadarko Petroleum Corporation Common Stock
192,APD,"Air Products and Chemicals, Inc. Common Stock"
193,APF,Morgan Stanley Asia
194,APH,Amphenol Corporation Common Stock
195,APL,"Atlas Pipeline Partners, L.P. Common Units, No Par Value"
196,APL-E,"Atlas Pipeline Partners, L.P. Cumulative Redeemable Perpetual Preferred Units Class E"
197,APO,"Apollo Global Management, LLC Class A Common Shares Representing Class A Limitied Liability Company Interests"
198,APU,"AmeriGas Partners, L.P. Common Stock"
199,AR,Antero Resources Corporation Common Stock
200,ARC,"ARC Document Solutions, Inc. Common Stock"
201,ARCO,Arcos Dorados Holdings Inc. Class A Shares
202,ARCX,Arc Logistic Partners LP Common Units representing limited partner interest
203,ARDC,"Ares Dynamic Credit Allocation Fund, Inc. Common Shares"
204,ARE,"Alexandria Real Estate Equities, Inc. Common Stock"
205,ARE-E,"Alexandria Real Estate Equities, Inc. Pfd Ser E"
206,ARES,Ares Management L.P. Common Units representing Limited Partner Interests
207,ARG,"Airgas, Inc. Common Stock"
208,ARH-C,Arch Capital Group Ltd. 6.75% PFD sh S C
209,ARI,"Apollo Commercial Real Estate Finance, Inc"
210,ARI-A,Apollo Commercial Real Estate Finance Cumulative Redeemable Perpetual Preferred Stock Series A
211,ARL,"American Realty Investors, Inc. Common Stock"
212,ARMF,Ares Multi
213,ARMK,Aramark Common Stock
214,ARN,Ares Capital Corporation 7.00% Senior Notes due 2022
215,ARO,Aeropostale Inc Common Stock
216,ARP,"Atlas Resource Partners, L.P. Common Units representing Limited Partner Interests"
217,ARP-D,"Atlas Resource Partners, L.P. CUM RED PERP PDF UNIT CL D %"
218,ARPI,"American Residential Properties, Inc. Common Stock"
219,ARR,"ARMOUR Residential REIT, Inc."
220,ARR-A,Armour Residential REIT INC Preferred Series A
221,ARR-B,"ARMOUR Residential REIT, Inc. Preferred Series B"
222,ARU,Ares Capital Corporation 5.875% Senior Notes due 2022
223,ARW,"Arrow Electronics, Inc. Common Stock"
224,ARY,Ares Capital Corporation 7.75% Senior Notes due 2040
225,ASA,ASA  Gold and Precious Metals Limited
226,ASB,Associated Banc
227,ASB-B,Associated Banc
228,ASC,Ardmore Shipping Corporation Common Stock
229,ASG,Liberty All
230,ASGN,"On Assignment, Inc. Common Stock"
231,ASH,Ashland Inc. (NEW) Common Stock
232,ASPN,"Aspen Aerogels, Inc. Common Stock"
233,ASR,"Grupo Aeroportuario del Sureste, S.A. de C.V. Common Stock"
234,ASX,"Advanced Semiconductor Engineering, Inc. Common Stock"
235,AT,Atlantic Power Corporation Ordinary Shares (Canada)
236,ATE,Advantest Corporation (Kabushiki Kaisha Advantest) ADS American Depositary Shares
237,ATEN,"A10 Networks, Inc. Common Stock"
238,ATHM,"Autohome Inc. American Depositary Shares, each representing one class A ordinary share."
239,ATI,Allegheny Technologies Incorporated Common Stock
240,ATK,Alliant Techsystems Inc. Common Stock
241,ATLS,"Atlas Energy, L.P. Common Units"
242,ATO,Atmos Energy Corporation Common Stock
243,ATR,"AptarGroup, Inc. Common Stock"
244,ATTO,Atento S.A. Ordinary Shares
245,ATU,Actuant Corporation Common Stock
246,ATV,"Acorn International, Inc. ADS"
247,ATW,"Atwood Oceanics, Inc. Common Stock"
248,AU,AngloGold Ashanti Limited Common Stock
249,AUO,AU Optronics Corp American Depositary Shares
250,AUQ,AuRico Gold Inc. Ordinary Shares
251,AUY,Yamana Gold Inc. Ordinary Shares (Canada)
252,AV,Aviva plc Unsponsored ADR (UK)
253,AVA,Avista Corporation Common Stock
254,AVAL,Grupo Aval Acciones y Valores S.A. ADR (Each representing 20 preferred shares)
255,AVB,"AvalonBay Communities, Inc. Common Stock"
256,AVD,American Vanguard Corporation Common Stock ($0.10 Par Value)
257,AVG,AVG Technologies N.V. Ordinary Shares
258,AVH,Avianca Holdings S.A. American Depositary Shares (Each representing 8 preferred Shares)
259,AVIV,"Aviv REIT, Inc. Common Stock"
260,AVK,Advent Claymore Convertible Securities and Income Fund
261,AVOL,Avolon Holdings Limited Common Shares
262,AVP,"Avon Products, Inc. Common Stock"
263,AVT,"Avnet, Inc. Common Stock"
264,AVV,Aviva plc Subordinated Capital Securities due 2041
265,AVX,AVX Corporation Common Stock
266,AVY,Avery Dennison Corporation Common Stock
267,AWF,Alliancebernstein Global High Income Fund
268,AWH,"Allied World Assurance Company Holdings, AG (Switzerland)"
269,AWI,Armstrong World Industries Inc Common Stock
270,AWK,"American Water Works Company, Inc. Common Stock"
271,AWP,Alpine Global Premier Properties Fund Alpine Global Premier Properties Fund Common Shares of Beneficial Interest
272,AWR,American States Water Company Common Stock
273,AXE,Anixter International Inc. Common Stock
274,AXL,"American Axle & Manufacturing Holdings, Inc. Common Stock"
275,AXLL,Axiall Corporation Common Stock
276,AXP,American Express Company Common Stock
277,AXR,AMREP Corporation Common Stock
278,AXS,Axis Capital Holdings Limited Common Stock
279,AXS-C,Axis Capital Holdings Limited Preferred Series C (Bermuda)
280,AXS-D,Axis Capital Holdings Limited Preferred Series D (Bermuda)
281,AXTA,Axalta Coating Systems Ltd. Common Shares
282,AYI,Acuity Brands Inc (Holding Company)
283,AYN,Alliance New York Municipal Income Fund Inc
284,AYR,Aircastle Limited Common Stock
285,AZN,Astrazeneca PLC Common Stock
286,AZO,"AutoZone, Inc. Common Stock"
287,AZZ,AZZ Incorporated Common Stock
288,B,"Barnes Group, Inc. Common Stock"
289,BA,Boeing Company (The) Common Stock
290,BABA,Alibaba Group Holding Limited American Depositary Shares each representing one Ordinary share
291,BAC,Bank of America Corporation Common Stock
292,BAC-D,Bank of America Corporation Depositary Shares Rpstg 1/1000th Interest in Sh of Non Cum Pfd Stk Ser D
293,BAC-E,Bank of America Corporation Depositary Sh repstg 1/1000th Perp Pfd Ser E
294,BAC-I,Bank Amer Corp Dep Sh Repstg 1/1000th Pfd Ser I
295,BAC-L,Bank of America Corporation Non Cumulative Perpetual Conv Pfd Ser L
296,BAC-W,Bank of America Corporation Depository Shares Representing 1/1000th Preferred Series W
297,BAC-Z,Bank of America Corporation BAC Capital Trust VIII 6% Capital Securities
298,BAC.A,"Bank of America Corporation Class A Warrant expiring January 16, 2019"
299,BAC.B,Bank of America Corporation Class B Warrants expiring 10/28/2018
300,BAF,BlackRock Municipal Income Investment Quality Trust
301,BAH,Booz Allen Hamilton Holding Corporation Common Stock
302,BAK,Braskem SA ADR
303,BALT,Baltic Trading Limited Common Stock
304,BAM,Brookfield Asset Management Inc. Common Stock
305,BANC,"Banc of California, Inc. Common Stock"
306,BANC-C,"Banc of California, Inc. Depositary Shares"
307,BAP,Credicorp Ltd. Common Stock
308,BAS,"Basic Energy Services, Inc. Common Stock"
309,BAX,Baxter International Inc. Common Stock
310,BBD,Banco Bradesco Sa American Depositary Shares
311,BBDO,Banco Bradesco Sa American Depositary Shares (each representing one Common Share)
312,BBF,BlackRock Municipal Income Investment Trust
313,BBG,Bill Barrett Corporation Common Stock
314,BBK,Blackrock Municipal Bond Trust
315,BBL,BHP Billiton plc Sponsored ADR
316,BBN,BlackRock Build America Bond Trust Common Shares of Beneficial Interest
317,BBT,BB&T Corporation Common Stock
318,BBT-D,BB&T Corporation Depositary Shares Representing 1/1000th Perpetual Preferred Series D
319,BBT-E,BB&T Corporation Depositary Shares Representing 1/1000th Perpetual Preferred Series E
320,BBT-F,BB&T Corporation Depositary Shares Representing 1/1000th Interest Series F Perpetual Preferred
321,BBT-G,BB&T Corporation Depositary Shares Representing 1/1000th Perpetual Preferred Series G
322,BBVA,Banco Bilbao Vizcaya Argentaria S.A. Common Stock
323,BBW,Build
324,BBX,BBX Capital Corporation Common Stock
325,BBY,"Best Buy Co., Inc. Common Stock"
326,BC,Brunswick Corporation Common Stock
327,BCA,Corpbanca Sponsored Reg S GDR representing Common (Chile)
328,BCC,"Boise Cascade, L.L.C. Common Stock"
329,BCE,"BCE, Inc. Common Stock"
330,BCEI,"Bonanza Creek Energy, Inc. Common Stock"
331,BCH,Banco De Chile Banco De Chile ADS
332,BCO,Brinks Company (The) Common Stock
333,BCR,"C.R. Bard, Inc. Common Stock"
334,BCRH,Blue Capital Reinsurance Holdings Ltd. Common Shares
335,BCS,Barclays PLC Common Stock
336,BCS-,Barclays Bank PLC ADR Ser 2 repstg Pref Shs Ser 2 (United Kingdom)
337,BCS-A,Barclays PLC ADS
338,BCS-C,Barclays PLC American Depositary Shares Series 4
339,BCS-D,Barclays PLC American Depositary Shares (Each representing Non
340,BCX,BlackRock Resources Common Shares of Beneficial Interest
341,BDC,Belden Inc Common Stock
342,BDJ,Blackrock Enhanced Equity Dividend Trust
343,BDN,Brandywine Realty Trust Common Stock
344,BDN-E,Brandywine Realty Tr Pfd Shs Ben Int Ser E
345,BDX,"Becton, Dickinson and Company Common Stock"
346,BEE,Strategic Hotels & Resorts  Inc Common Stock
347,BEL,Belmond Ltd. Class A Common Stock
348,BEN,"Franklin Resources, Inc. Common Stock"
349,BEP,Brookfield Renewable Energy Partners LP Partnership Units (Bermuda)
350,BERY,"Berry Plastics Group, Inc. Common Stock"
351,BF.A,Brown Forman Inc Class A Common Stock
352,BF.B,Brown Forman Inc Class B Common Stock
353,BFAM,Bright Horizons Family Solutions Inc. Common Stock
354,BFK,BlackRock Municipal Income Trust
355,BFO,Blackrock Florida Municipal 2020 Term Trust
356,BFR,BBVA Banco Frances S.A. Common Stock
357,BFS,"Saul Centers, Inc. Common Stock"
358,BFS-C,"Saul Centers, Inc. Depositary Shares, each representing 1/100th of a share of 6.875% Series C Cumulative Redeemable Preferred Stock, $0.01 par value"
359,BFZ,BlackRock California Municipal Income Trust
360,BG,Bunge Limited Bunge Limited
361,BGB,Blackstone / GSO Strategic Credit Fund Common Shares
362,BGC,General Cable Corporation Common Stock
363,BGCA,"BGC Partners, Inc. 8.125% Senior Notes due 2042"
364,BGE-B,Bge Cap Trust II 6.20% Trust Preferred Securities
365,BGG,Briggs & Stratton Corporation Common Stock
366,BGH,Babson Capital Global Short Duration High Yield Fund Common Shares of Beneficial Interests
367,BGR,BlackRock Energy and Resources Trust
368,BGS,"B&G Foods, Inc. B&G Foods, Inc. Common Stock"
369,BGT,BlackRock Floating Rate Income Trust
370,BGX,Blackstone GSO Long Short Credit Income Fund Common Shares
371,BGY,"BLACKROCK INTERNATIONAL, LTD. Blackrock International Real Estate Fund, Inc."
372,BH,Biglari Holdings Inc.
373,BHE,"Benchmark Electronics, Inc. Common Stock"
374,BHI,Baker Hughes Incorporated Common Stock
375,BHK,Blackrock Core Bond Trust Blackrock Core Bond Trust
376,BHL,Blackrock Defined Opportunity Credit Trust Blackrock Defined Opportunity Credit Trust
377,BHLB,"Berkshire Hills Bancorp, Inc. Common Stock"
378,BHP,BHP Billiton Limited Common Stock
379,BID,Sotheby's Common Stock
380,BIE,BlackRock Municipal Bond Investment Trust
381,BIF,"Boulder Growth & Income Fund, Inc."
382,BIG,"Big Lots, Inc. Common Stock"
383,BIN,Progressive Waste Solutions Ltd. Common Shares
384,BIO,Bio
385,BIO.B,Bio
386,BIOA,BioAmber Inc. Common Stock
387,BIOA.W,"BioAmber Inc. Warrant, expiring May 9, 2017"
388,BIP,Brookfield Infrastructure Partners LP Limited Partnership Units
389,BIT,BlackRock Multi
390,BITA,Bitauto Holdings Limited American Depositary Shares (each representing one ordinary share)
391,BJZ,Blackrock California Municipal 2018 Term Trust Blackrock California Municipal 2018 Term Trust
392,BK,Bank of New York Mellon Corporation (The) Common Stock
393,BK-C,Bank Of New York Mellon Corporation (The) Dep Shs Repstg 1/4000th Perp Pfd Ser C
394,BKD,Brookdale Senior Living Inc. Common Stock
395,BKE,"Buckle, Inc. (The) Common Stock"
396,BKH,Black Hills Corporation Common Stock
397,BKK,Blackrock Municipal 2020 Term Trust
398,BKN,BlackRock Investment Quality Municipal Trust Inc. (The)
399,BKS,"Barnes & Noble, Inc. Common Stock"
400,BKT,BlackRock Income Trust Inc. (The)
401,BKU,"BankUnited, Inc. Common Stock"
402,BLH,Blackrock New York Municipal 2018 Term Trust
403,BLK,"BlackRock, Inc. Common Stock"
404,BLL,Ball Corporation Common Stock
405,BLOX,Infoblox Inc. Common Stock
406,BLT,"Blount International, Inc. Common Stock"
407,BLW,Blackrock Limited Duration Income Trust
408,BLX,"Banco Latinoamericano de Comercio Exterior, S.A."
409,BMA,Banco Macro S.A.  ADR (representing Ten Class B Common Shares)
410,BME,Blackrock Health Sciences Trust
411,BMI,"Badger Meter, Inc. Common Stock"
412,BML-G,Bank of America Corporation Bank of America Corporation Depositary Shares (Each representing a 1/1200th interest in a share of Floating Rate Non
413,BML-H,Bank of America Corporation Bank of America Corporation Depositary Shares (Each representing a 1/1200th interest in a Share of Floating Rate Non
414,BML-I,Bank of America Corporation Bank of America Corporation Depositary Shares (Each representing a 1/1200th interest in a Share of 6.375% Non
415,BML-J,Bank of America Corporation Bank of America Corporation Depositary Shares (Each representing a 1/1200th interest in a Share of Floating Rate Non
416,BML-L,Bank of America Corporation Bank of America Corporation Depositary Shares (Each representing a 1/1200th Interest in a Share of Floating Rate Non
417,BMO,Bank Of Montreal Common Stock
418,BMR,Biomed Realty Trust Common Stock
419,BMS,"Bemis Company, Inc. Common Stock"
420,BMY,Bristol
421,BNJ,BlackRock New Jersey Municipal Income Trust
422,BNK,"C1 Financial, Inc. Common Stock"
423,BNS,Bank Nova Scotia Halifax Pfd 3 Ordinary Shares
424,BNY,BlackRock New York Municipal Income Trust
425,BOCA,"Banc of California, Inc. Senior Note due 4/15/2020"
426,BOE,Blackrock Global Blackrock Global Opportunities Equity Trust Common Shares of Beneficial Interest
427,BOH,Bank of Hawaii Corporation Common Stock
428,BOI,Brookfield Mortgage Opportunity Income Fund Inc. Common Stock
429,BOOT,"Boot Barn Holdings, Inc. Common Stock"
430,BORN,China New Borun Corporation American Depositary Shares
431,BOXC,Brookfield Canada Office Properties
432,BP,BP p.l.c. Common Stock
433,BPI,"Bridgepoint Education, Inc."
434,BPK,Blackrock Municipal 2018 Term Trust Blackrock Municipal 2018 Term Trust
435,BPL,Buckeye Partners L.P. Common Stock
436,BPT,BP Prudhoe Bay Royalty Trust Common Stock
437,BPY,Brookfield Property Partners L.P. Limited Partnership Units
438,BPZ,"BPZ Resources, Inc Common Stock"
439,BQH,Blackrock New York Municipal Bond Trust Common Shares of Beneficial Interest
440,BR,"Broadridge Financial Solutions, Inc.Common Stock"
441,BRC,Brady Corporation Common Stock
442,BRFS,BRF S.A.
443,BRK.A,Berkshire Hathaway Inc. Common Stock
444,BRK.B,Berkshire Hathaway Inc. New Common Stock
445,BRO,"Brown & Brown, Inc. Common Stock"
446,BRP,Brookfield Residential Properties Inc. Common Stock
447,BRS,Bristow Group Inc. Common Stock
448,BRSS,"Global Brass and Copper Holdings, Inc. Common Stock"
449,BRT,BRT Realty Trust Common Stock
450,BRX,Brixmor Property Group Inc. Common Stock
451,BSAC,Banco Santander
452,BSBR,"Banco Santander Brasil SA American Depositary Shares, each representing one unit"
453,BSD,BlackRock Strategic Municipal Trust Inc. (The) Common Stock
454,BSE,Blackrock New York Municipal Income Quality Trust Common Shares of Beneficial Interest
455,BSI,Alon Blue Square Israel Ltd.
456,BSL,Blackstone GSO Senior Floating Rate Term Fund Common Shares of Beneficial Interest
457,BSMX,"Grupo Financiero Santander Mexico S.A. B. de C.V. American Depositary Shares, each representing five Series B shares"
458,BST,BlackRock Science and Technology Trust Common Shares of Beneficial Interest
459,BSX,Boston Scientific Corporation Common Stock
460,BT,BT Group plc Common Stock
461,BTA,BlackRock Long
462,BTE,Baytex Energy Corp
