id,ticker,stock_name
2262,ONE,"Higher One Holdings, Inc. Common Stock"
2263,OPK,OPKO Health Inc. Common Stock
2264,OPWR,"Opower, Inc. Common Stock"
2265,OPY,"Oppenheimer Holdings, Inc. Class A Common Stock (DE)"
2266,ORA,"Ormat Technologies, Inc. Common Stock"
2267,ORAN,Orange
2268,ORB,Orbital Sciences Corporation Common Stock
2269,ORC,"Orchid Island Capital, Inc. Common Stock"
2270,ORCL,Oracle Corporation Common Stock
2271,ORI,Old Republic International Corporation Common Stock
2272,ORN,Orion Marine Group Inc Common
2273,OSK,Oshkosh Corporation (Holding Company)Common Stock
2274,OUBS,UBS AG Common Stock
2275,OUT,OUTFRONT Media Inc. Common Stock
2276,OWW,"Orbitz Worldwide, Inc. Common Stock"
2277,OXM,"Oxford Industries, Inc. Common Stock"
2278,OXY,Occidental Petroleum Corporation Common Stock
2279,OZM,Och
2280,P,"Pandora Media, Inc. Common Stock"
2281,PAA,"Plains All American Pipeline, L.P. Common Stock"
2282,PAC,"Grupo Aeroportuario Del Pacifico, S.A. B. de C.V. Grupo Aeroportuario Del Pacifico, S.A. de C.V. (each representing 10 Series B shares)"
2283,PACD,Pacific Drilling S.A. Common Shares
2284,PAG,"Penske Automotive Group, Inc. Common Stock"
2285,PAGP,"Plains Group Holdings, L.P. Class A Shares representing limited partner interests"
2286,PAH,Platform Specialty Products Corporation Common Stock
2287,PAI,Western Asset Income Fund Common Stock
2288,PAM,Pampa Energia S.A. Pampa Energia S.A.
2289,PANW,"Palo Alto Networks, Inc. Common Stock"
2290,PAR,PAR Technology Corporation Common Stock
2291,PAY,"Verifone Systems, Inc. Common Stock"
2292,PAYC,"Paycom Software, Inc. Common Stock"
2293,PB,"Prosperity Bancshares, Inc. Common Stock"
2294,PBA,Pembina Pipeline Corp. Ordinary Shares (Canada)
2295,PBF,PBF Energy Inc. Class A Common Stock
2296,PBFX,PBF Logistics LP Common Units representing limited partner interests
2297,PBH,"Prestige Brand Holdings, Inc. Common Stock"
2298,PBI,Pitney Bowes Inc. Common Stock
2299,PBI-A,Pitney Bowes Inc 5.25% Notes due 2022
2300,PBI-B,Pitney Bowes Inc 6.70% Notes Due 2043
2301,PBR,Petroleo Brasileiro S.A.
2302,PBR.A,Petroleo Brasileiro S.A.
2303,PBT,Permian Basin Royalty Trust Common Stock
2304,PBY,Pep Boys
2305,PBYI,Puma Biotechnology Inc Common Stock
2306,PCF,Putnam High Income Securities Fund Common Stock
2307,PCG,Pacific Gas & Electric Co. Common Stock
2308,PCI,PIMCO Dynamic Credit Income Fund Common Shares of Beneficial Interest
2309,PCK,Pimco California Municipal Income Fund II Common Shares of Beneficial Interest
2310,PCL,"Plum Creek Timber Company, Inc. Common Stock"
2311,PCM,"PCM Fund, Inc. Common Stock"
2312,PCN,Pimco Corporate & Income Strategy Fund Common Stock
2313,PCP,Precision Castparts Corporation Common Stock
2314,PCQ,PIMCO California Municipal Income Fund Common Stock
2315,PDI,PIMCO Dynamic Income Fund Common Stock
2316,PDM,"Piedmont Office Realty Trust, Inc. Class A Common Stock"
2317,PDS,Precision Drilling Corporation Common Stock
2318,PDT,John Hancock Premium Dividend Fund
2319,PE,"Parsley Energy, Inc. Class A Common Stock"
2320,PEB,Pebblebrook Hotel Trust Common Shares of Beneficial Interest
2321,PEB-A,Pebblebrook Hotel Trust PFD SER A
2322,PEB-B,Pebblebrook Hotel Trust Preferred Series B
2323,PEB-C,Pebblebrook Hotel Trust 6.50% Series C Cumulative Redeemable Preferred Shares of Beneficial Interest
2324,PEG,Public Service Enterprise Group Incorporated Common Stock
2325,PEI,Pennsylvania Real Estate Investment Trust Common Stock
2326,PEI-A,Pennsylvania Real Estate Investment Trust PFD sh CL A
2327,PEI-B,Pennsylvania Real Estate Investment Trust Cumulative Redeemable Perpetual Preferred Shares Series B
2328,PEO,Petroleum Resources Corporation Common Stock
2329,PEP,"Pepsico, Inc. Common Stock"
2330,PER,SandRidge Permian Trust Common Units of Benficial Interest
2331,PES,Pioneer Energy Services Corp. Common Stk
2332,PF,"Pinnacle Foods, Inc. Common Stock"
2333,PFD,Flaherty & Crumrine Preferred Income Fund Incorporated Common Stock
2334,PFE,"Pfizer, Inc. Common Stock"
2335,PFG,Principal Financial Group Inc Common Stock
2336,PFG-B,"Principal Financial Group, Inc. 6.518% Series B Non"
2337,PFH,Cabco Tr Jcp 7.625 Common Stock
2338,PFK,Prudential Financial Inflation
2339,PFL,PIMCO Income Strategy Fund Shares of Beneficial Interest
2340,PFN,PIMCO Income Strategy Fund II
2341,PFO,Flaherty & Crumrine Preferred Income Opportunity Fund Incorporated Common Stock
2342,PFS,"Provident Financial Services, Inc Common Stock"
2343,PFSI,"PennyMac Financial Services, Inc. Class A Common Stock"
2344,PFX,"Phoenix Companies, Inc. Phoenix Companies Inc 7.45% Pfd"
2345,PG,Procter & Gamble Company (The) Common Stock
2346,PGEM,"Ply Gem Holdings, Inc. Common Stock"
2347,PGH,Pengrowth Energy Corporation
2348,PGI,"Premiere Global Services, Inc."
2349,PGN,Paragon Offshore plc Ordinary Shares
2350,PGP,Pimco Global Stocksplus & Income Fund Pimco Global StocksPlus & Income Fund Common Shares of Beneficial Interest
2351,PGR,Progressive Corporation (The) Common Stock
2352,PGRE,"Paramount Group, Inc. Common Stock"
2353,PGZ,Principal Real Estate Income Fund Common Shares of Beneficial Interest
2354,PH,Parker
2355,PHD,Pioneer Floating Rate Trust Pioneer Floating Rate Trust Shares of Beneficial Interest
2356,PHG,Koninklijke Philips N.V. NY Registry Shares
2357,PHH,PHH Corp Common Stock
2358,PHI,Philippine Long Distance Telephone Company Sponsored ADR
2359,PHK,Pimco High Income Fund Pimco High Income Fund
2360,PHM,"PulteGroup, Inc. Common Stock"
2361,PHT,Pioneer High Income Trust Common Shares of Beneficial Interest
2362,PHX,Panhandle Oil and Gas Inc Common Stock
2363,PII,Polaris Industries Inc. Common Stock
2364,PIM,Putnam Master Intermediate Income Trust Common Stock
2365,PIR,"Pier 1 Imports, Inc. Common Stock"
2366,PIY,Preferred Plus Trust (Ser CZN) Preferred Plus Trust Ser CZN
2367,PJC,Piper Jaffray Companies Common Stock
2368,PJH,"Prudential Financial, Inc. 5.75% Junior Subordinated Notes due 2052"
2369,PJS,PreferredPlus Trust Ser FAR 1 Tr Ctf
2370,PKD,Parker Drilling Company Common Stock
2371,PKE,Park Electrochemical Corporation Common Stock
2372,PKG,Packaging Corporation of America Common Stock
2373,PKI,"PerkinElmer, Inc. Common Stock"
2374,PKO,Pimco Income Opportunity Fund Common Shares of Beneficial Interest
2375,PKX,POSCO Common Stock
2376,PKY,"Parkway Properties, Inc. Common Stock"
2377,PL,Protective Life Corporation Common Stock
2378,PL-B,Protective Life Corporation PLC Capital Trust V Trust Originated Preferred Securities (TOPRS)
2379,PL-C,Protective Life Corporation 6.25% Subordinated Debentures due 2042
2380,PL-E,Protective Life Corporation 6.00% Subordinated Debentures due 2042
2381,PLD,"ProLogis, Inc. Common Stock"
2382,PLL,Pall Corporation Common Stock
2383,PLOW,"Douglas Dynamics, Inc. Common Stock"
2384,PLT,"Plantronics, Inc. Common Stock"
2385,PM,Philip Morris International Inc Common Stock
2386,PMC,Pharmerica Corporation Common Stock
2387,PMF,PIMCO Municipal Income Fund Common Stock
2388,PML,Pimco Municipal Income Fund II Common Shares of Beneficial Interest
2389,PMM,Putnam Managed Municipal Income Trust Common Stock
2390,PMO,Putnam Municipal Opportunities Trust Common Stock
2391,PMT,PennyMac Mortgage Investment Trust Common Shares of Beneficial Interest
2392,PMX,PIMCO Municipal Income Fund III Common Shares of Beneficial Interest
2393,PNC,"PNC Financial Services Group, Inc. (The) Common Stock"
2394,PNC-P,"PNC Financial Services Group, Inc. (The) Depositary Shares Representing 1/4000th Perpetual Preferred Series P"
2395,PNC-Q,"PNC Financial Services Group, Inc. (The) Depositary Shares Representing 1/4000th Perpetual Preferred Shares Series Q"
2396,PNC.W,"PNC Financial Services Group, Inc. Warrant expiring December 31, 2018"
2397,PNF,PIMCO New York Municipal Income Fund Common Stock
2398,PNI,Pimco New York Municipal Income Fund II Common Shares of Beneficial Interest
2399,PNK,"Pinnacle Entertainment, Inc. Common Stock"
2400,PNM,"PNM Resources, Inc. (Holding Co.) Common Stock"
2401,PNR,Pentair plc. Ordinary Share
2402,PNTA,PennantPark Investment Corporation 6.25% Senior Notes due 2025
2403,PNW,Pinnacle West Capital Corporation Common Stock
2404,PNX,"Phoenix Companies, Inc. (The) Common Stock"
2405,PNY,"Piedmont Natural Gas Company, Inc. Common Stock"
2406,POL,PolyOne Corporation Common Stock
2407,POM,"PEPCO Holdings, Inc Common Stock"
2408,POR,Portland General Electric Co Common Stock
2409,POST,"Post Holdings, Inc. Common Stock"
2410,POT,Potash Corporation of Saskatchewan Inc. Common Stock
2411,POWR,"PowerSecure International, Inc. Common Stock"
2412,PPG,"PPG Industries, Inc. Common Stock"
2413,PPL,PP&L Corporation Common Stock
2414,PPO,Polypore International Inc Common Stock
2415,PPP,Primero Mining Corp.  New Common Shares (Canada)
2416,PPR,Voya Prime Rate Trust Shares of Beneficial Interest
2417,PPS,"Post Properties, Inc. Common Stock"
2418,PPS-A,"Post Properties, Inc. Preferred Stock"
2419,PPT,Putnam Premier Income Trust Common Stock
2420,PPX,"PPL Capital Funding, Inc. 2013 Series B Junior Subordinated Notes due 2073"
2421,PQ,Petroquest Energy Inc Common Stock
2422,PRA,ProAssurance Corporation Common Stock
2423,PRE,PartnerRe Ltd. Common Stock
2424,PRE-D,PartnerRe Ltd. Preferred Series D 6.5% (Bermuda)
2425,PRE-E,PartnerRe Ltd. PFD SER E (Bermuda)
2426,PRE-F,PartnerRe Ltd. Redeemable Preferred Shares Series F (Bermuda)
2427,PRGO,Perrigo Company plc Ordinary Shares
2428,PRH,"Prudential Financial, Inc. 5.70% Junior Subordinated Notes due 2053"
2429,PRI,"Primerica, Inc. Common Stock"
2430,PRLB,"Proto Labs, Inc. Common stock"
2431,PRO,"PROS Holdings, Inc. Common Stock"
2432,PRU,"Prudential Financial, Inc. Common Stock"
2433,PRY,Prospect Capital Corporation 6.95% Senior Notes due 2022
2434,PSA,Public Storage Common Stock
2435,PSA-A,"Public Storage Depositary Shares each representing 1/1,000 of a 5.875% Cumulative Preferred SBI, Series A"
2436,PSA-O,Public Storage Depositary Shares Representing 1/1000% Cumulative Pfd Sh Ben Int Series O
2437,PSA-P,Public Storage DEPOSITARY SHS REPSTG % CUMULATIVE PFD SHS BEN INT (SER P)
2438,PSA-Q,Public Storage DEPOSITARY SHS REPSTG 1/1000TH PFD SHS BEN INT SER Q
2439,PSA-R,Public Storage Depository Sh Repstg 1/1000th Pfd Ser R
2440,PSA-S,Public Storage DEP SH REPSTG PFD SH BEN INT SER S
2441,PSA-T,Public Storage Depository Shares Representing 1/1000 Pfd Shares Beneficial Interest Series T
2442,PSA-U,Public Storage Depositary Shares Representing 1/1000 Preferred Benerficial Interest Series U
2443,PSA-V,Public Storage Dep Shs Repstg 1/1000th Pfd Sh Ben Int Ser V
2444,PSA-W,Public Storage Depositary Shares Representing 1/1000 Preferred Shares of Benficial Interest Series W
2445,PSA-X,Public Storage Depositary Shares Representing 1/1000th Cumulative Preferred Shares Beneficial Interest Series X
2446,PSA-Y,Public Storage Dep Shs Repstg 1/1000th Pfd Sh Ben Int Ser Y
2447,PSA-Z,Public Storage Dep Shs Representing 1/1000th Pfd Sh Ben Int Ser Z
2448,PSB,"PS Business Parks, Inc. Common Stock"
2449,PSB-R,"PS Business Parks, Inc. Depositary Shares, Each representing 1/1,000 of a share of 6.875% Cumulative Preferred stock, Series R, $0.01 par"
2450,PSB-S,"PS Business Parks, Inc. Depositary Shares, each representing 1/1,000 of a share of 6.45% Cumulative Preferred Stock"
2451,PSB-T,"PS Business Parks, Inc. Depositary Shares Representing 1/1000th Preferred Series T"
2452,PSB-U,"PS Business Parks, Inc. Dep Shs Repstg 1/1000 Pfd Ser U"
2453,PSB-V,"PS Business Parks, Inc. Depositary Shares Represting 1/1000th Shares Cumulative Preferred Stock Series V"
2454,PSF,"Cohen & Steers Select Preferred and Income Fund, Inc. Common Stock"
2455,PSG,Performance Sports Group Ltd. Ordinary Shares (Canada)
2456,PSO,"Pearson, Plc Common Stock"
2457,PSX,Phillips 66 Common Stock
2458,PSXP,Phillips 66 Partners LP Common Units representing limited partner interest in the Partnership
2459,PT,"Portugal Telecom SGPS, S.A . Common Stock"
2460,PTP,"Platinum Underwriters Holdings, Ltd"
2461,PTR,PetroChina Company Limited Common Stock
2462,PTY,Pimco Corporate & Income Opportunity Fund
2463,PUK,Prudential Public Limited Company Common Stock
2464,PUK-,Prudential Public Limited Company 6.75% Perpetual Subordinated Captial Security
2465,PUK-A,Prudential Public Limited Company 6.50% Perpetual Subordinated Capital Securities Exchangeable at the Issuer's Option Into Non
2466,PVA,Penn Virginia Corporation Common Stock
2467,PVG,"Pretium Resources, Inc. Ordinary Shares (Canada)"
2468,PVH,PVH Corp. Common Stock
2469,PVTD,"PrivateBancorp, Inc. 7.125% Subordinated Debentures due 2042"
2470,PWE,Penn West Petroleum Ltd
2471,PWR,"Quanta Services, Inc. Common Stock"
2472,PX,"Praxair, Inc. Common Stock"
2473,PXD,Pioneer Natural Resources Company Common Stock
2474,PYB,PPlus Trust Series GSG
2475,PYN,PIMCO New York Municipal Income Fund III Common Shares of Beneficial Interest
2476,PYS,Merrill Lynch Depositor Inc PPlus Tr Ser RRD
2477,PYT,PPlus Tr GSC
2478,PZB,"Merrill Lynch Depositor, Inc. Merrill Lynch Depositor, Inc. PPLUS Class A 6.7% Callable Trust Certificates, Series LTD"
2479,PZC,PIMCO California Municipal Income Fund III Common Shares of Beneficial Interest
2480,PZE,Petrobras Argentina S.A. ADS
2481,PZN,Pzena Investment Management Inc Class A Common Stock
2482,Q,Quintiles Transnational Holdings Inc. Common Stock
2483,QEP,"QEP Resources, Inc. Common Stock"
2484,QEPM,"QEP Midstream Partners, LP Common Units representing Limited Partner Interests"
2485,QIHU,"Qihoo 360 Technology Co. Ltd. American Depositary Shares, every 2 of which representing three Class A Ordinary Shares"
2486,QSR,Restaurant Brands International Inc. Common Shares
2487,QTM,Quantum Corporation Common Stock
2488,QTS,"QTS Realty Trust, Inc. Class A Common Stock"
2489,QTWO,"Q2 Holdings, Inc. Common Stock"
2490,QUAD,"Quad Graphics, Inc Class A Common Stock"
2491,R,"Ryder System, Inc. Common Stock"
2492,RAD,Rite Aid Corporation Common Stock
2493,RAI,Reynolds American Inc Common Stock
2494,RALY,Rally Software Development Corp. Common Stock
2495,RAS,RAIT Financial Trust New Common Shares of Beneficial Interest
2496,RAS-A,RAIT Financial Trust  7.75% Series A Cumulative Redeemable Preferred Shares of Beneficial Interest
2497,RAS-B,RAIT Financial Trust 8.375% Series B Cumulative Redeemable Preferred Shares of Beneficial Interest
2498,RAS-C,RAIT Financial Trust 8.875% Series C Cumulative Redeemable Preferred Shares of Beneficial Interest
2499,RATE,"Bankrate, Inc. Common Stock"
2500,RAX,"Rackspace Hosting, Inc Common Stock"
2501,RBA,Ritchie Bros. Auctioneers Incorporated Common Stock
2502,RBC,Regal Beloit Corporation Common Stock
2503,RBS,Royal Bank of Scotland Group Plc New (The) ADS
2504,RBS-E,RBS Capital Funding Trust V
2505,RBS-F,Royal Bank of Scotland Group Plc (The) Preferred Stock
2506,RBS-G,RBS Capital Funding Trust VII
2507,RBS-H,Royal Bank of Scotland Group Plc (The) Preferred Stock
2508,RBS-I,RBS Capital Funding Trust VI
2509,RBS-L,Royal Bank of Scotland Group Plc (The) ADR representing One Non
2510,RBS-M,Royal Bank of Scotland Group Plc (The) ADS Series M
2511,RBS-N,Royal Bank of Scotland Group Plc (The) Royal Bank of Scotland Group PLC (The) American Depositary Shares (each representing One Non
2512,RBS-P,Royal Bank of Scotland Group Plc (The) ADR representing Preferred Shares Series P
2513,RBS-Q,Royal Bank of Scotland Group Plc (The) ADR repstg Pref Shs Ser Q
2514,RBS-R,Royal Bank of Scotland Group Plc (The) ADR repstg USD Pfd Shs Ser R (United Kingdom)
2515,RBS-S,Royal Bank of Scotland Group Plc (The) Sponsored ADR Repstg Pref Ser S (United Kingdom)
2516,RBS-T,Royal Bank of Scotland Group Plc (The) Sponsored ADR Representing Pfef shs ser T (United Kingdom)
2517,RCAP,RCS CAPITAL CORPORATION Common Stock
2518,RCI,"Rogers Communication, Inc. Common Stock"
2519,RCL,Royal Caribbean Cruises Ltd. Common Stock
2520,RCS,"PIMCO Strategic Income Fund, Inc."
2521,RDC,Rowan Companies plc Class A Ordinary Shares
2522,RDN,Radian Group Inc. Common Stock
2523,RDS.A,Royal Dutch Shell PLC Royal Dutch Shell American Depositary Shares (Each representing two Class A Ordinary Shares)
2524,RDS.B,Royal Dutch Shell PLC Royal Dutch Shell PLC American Depositary Shares (Each representing two Class B Ordinary Shares)
2525,RDY,Dr. Reddy's Laboratories Ltd Common Stock
2526,RE,"Everest Re Group, Ltd. Common Stock"
2527,REG,Regency Centers Corporation Common Stock
2528,REG-F,Regency Centers Corporation Cumulative Red Preferred Series 6%
2529,REG-G,Regency Centers Corporation Pfd Ser 7%
2530,REN,Resolute Energy Corporation Comon Stock
2531,RENN,"Renren Inc. American Depositary Shares, each representing three Class A ordinary shares"
2532,RES,"RPC, Inc. Common Stock"
2533,RESI,Altisource Residential Corporation Common Stock
2534,REV,"Revlon, Inc. New Common Stock"
2535,REX,REX American Resources Corporation
2536,REXR,"Rexford Industrial Realty, Inc. Common Stock"
2537,RF,Regions Financial Corporation Common Stock
2538,RF-A,Regions Financial Corporation Depositary Shares Representing 1/40th Perpetual Preferred Series A
2539,RF-B,Regions Financial Corporation Depositary Shares Representing 1/40th Perpetual Preferred Series B
2540,RFI,"Cohen & Steers Total Return Realty Fund, Inc. Common Stock"
2541,RFP,Resolute Forest Products Inc. Common Stock
2542,RFT,RAIT Financial Trust 7.625% Senior Notes due 2024
2543,RFTA,RAIT Financial Trust 7.125% Senior Notes due 2019
2544,RGA,"Reinsurance Group of America, Incorporated Common Stock"
2545,RGC,Regal Entertainment Group Class A Common Stock
2546,RGP,Regency Energy Partners LP Common Units Representing Limited Partner Interests
2547,RGR,"Sturm, Ruger & Company, Inc. Common Stock"
2548,RGS,Regis Corporation Common Stock
2549,RGT,"Royce Global Value Trust, Inc. Common Stock"
2550,RH,Restoration Hardware Holdings Inc. Common Stock
2551,RHI,Robert Half International Inc. Common Stock
2552,RHP,"Ryman Hospitality Properties, Inc. (REIT)"
2553,RHT,"Red Hat, Inc. Common Stock"
2554,RICE,Rice Energy Inc. Common Stock
2555,RIG,Transocean Ltd (Switzerland) Common Stock
2556,RIGP,Transocean Partners LLC Common Units Representing Limited Liability Company Interests
2557,RIO,Rio Tinto Plc Common Stock
2558,RIOM,Rio Alto Mining Limited Common Shares (Canada)
2559,RIT,LMP Real Estate Income Fund Inc Common Stock
2560,RJD,"Raymond James Financial, Inc. 6.90% Senior Notes Due 2042"
2561,RJF,"Raymond James Financial, Inc. Common Stock"
2562,RKT,Rock
2563,RKUS,"Ruckus Wireless, Inc. Common Stock"
2564,RL,Ralph Lauren Corporation Common Stock
2565,RLD,RealD Inc Common Stock
2566,RLGY,Realogy Holdings Corp. Common Stock
2567,RLH,Red Lions Hotels Corporation Common Stock
2568,RLH-A,Red Lion Hotels Capital Trust Red Lion Hotels Capital Trust
2569,RLI,RLI Corp. Common Stock
2570,RLJ,RLJ Lodging Trust Common Shares of Beneficial Interest $0.01 par value
2571,RM,Regional Management Corp. Common Stock
2572,RMAX,"RE/MAX Holdings, Inc. Class A Common Stock"
2573,RMD,ResMed Inc. Common Stock
2574,RMP,Rice Midstream Partners LP Common Units representing limited partner interests
2575,RMT,Royce Micro
2576,RNDY,"Roundy's, Inc. Common Stock"
2577,RNE,"Morgan Stanley Eastern Europe Fund, Inc. Common Stock"
2578,RNF,"Rentech Nitrogen Partners, L.P. Common Units representing limited partner interests"
2579,RNG,"Ringcentral, Inc. Class A Common Stock"
2580,RNO,Rhino Resource Partners LP Common Units representing limited partnership interests
2581,RNP,Cohen & Steers Reit and Preferred Income Fund Inc Common Shares
2582,RNR,RenaissanceRe Holdings Ltd. Common Stock
2583,RNR-C,RenaissanceRe Holdings Ltd. 6.08% Series C Preference Shares
2584,RNR-E,RenaissanceRe Holdings Ltd. 5.375% Series E Preference Shares
2585,ROC,"Rockwood Holdings, Inc. Common Stock"
2586,ROG,Rogers Corporation Common Stock
2587,ROK,"Rockwell Automation, Inc. Common Stock"
2588,ROL,"Rollins, Inc. Common Stock"
2589,ROP,"Roper Industries, Inc. Common Stock"
2590,ROYT,Pacific Coast Oil Trust Units of Beneficial Interest
2591,RPAI,"Retail Properties of America, Inc. Class A Common Stock"
2592,RPAI-A,"Retail Properties of America, Inc. Pfd Ser A %"
2593,RPM,RPM International Inc. Common Stock
2594,RPT,Ramco
2595,RPT-D,Ramco
2596,RQI,Cohen & Steers Quality Income Realty Fund Inc Common Shares
2597,RRC,Range Resources Corporation Common Stock
2598,RRMS,"Rose Rock Midstream, L.P. Common Units Representing Limited Partner Interests"
2599,RRTS,"Roadrunner Transportation Systems, Inc Common Stock"
2600,RS,Reliance Steel & Aluminum Co. Common Stock
2601,RSE,"Rouse Properties, Inc. Common Stock"
2602,RSG,"Republic Services, Inc. Common Stock"
2603,RSH,Radioshack Corporation Common Stock
2604,RSO,Resource Capital Corp. Resource Capital Corp. Common Stock
2605,RSO-A,Resource Capital Corp. 8.50% Series A Cumulative Redeemable Preferred Stock
2606,RSO-B,Resource Capital Corp. Pfd Ser B
2607,RSO-C,Resource Capital Corp. Preferred Series C
2608,RSPP,"RSP Permian, Inc. Common Stock"
2609,RST,"Rosetta Stone Rosetta Stone, Inc."
2610,RT,"Ruby Tuesday, Inc. Common Stock"
2611,RTEC,"Rudolph Technologies, Inc. Common Stock"
2612,RTI,"RTI International Metals, Inc. Common Stock"
2613,RTN,Raytheon Company Common Stock
2614,RUBI,"The Rubicon Project, Inc. Common Stock"
2615,RUK,Reed Elsevier NV PLC New ADS
2616,RVT,"Royce Value Trust, Inc. Common Stock"
2617,RWT,"Redwood Trust, Inc. Common Stock"
2618,RXN,Rexnord Corporation Common Stock
2619,RY,Royal Bank Of Canada Common Stock
2620,RYAM,Rayonier Advanced Materials Inc. Common Stock
2621,RYI,Ryerson Holding Corporation Common Stock
2622,RYL,"Ryland Group, Inc. (The) Common Stock"
2623,RYN,Rayonier Inc. REIT Common Stock
2624,RZA,"Reinsurance Group of America, Incorporated 6.20% Fixed"
2625,S,Sprint Corporation Common Stock
2626,SA,"Seabridge Gold, Inc. Ordinary Shares (Canada)"
2627,SAH,"Sonic Automotive, Inc. Common Stock"
2628,SAIC,SCIENCE APPLICATIONS INTERNATIONAL CORPORATION Common Stock
2629,SALT,Scorpio Bulkers Inc. Common Stock
2630,SAM,"Boston Beer Company, Inc. (The) Common Stock"
2631,SAN,"Banco Santander, S.A. Sponsored ADR (Spain)"
2632,SAN-A,"Banco Santander, S.A. 6.80% Non"
2633,SAN-B,Santander Finance Preferred SA Unipersonal Floating Rate Non
2634,SAN-C,"Banco Santander, S.A. 6.50% Non"
2635,SAN-I,"Banco Santander Central Hispano, S.A. Santander Finance Preferred S.A. Unipersonal 6.41% Non"
2636,SAP,SAP  SE ADS
2637,SAQ,Saratoga Investment Corp 7.50% Notes due 2020
2638,SAR,Saratoga Investment Corp New
2639,SB,"Safe Bulkers, Inc Common Stock ($0.001 par value)"
2640,SB-B,"Safe Bulkers, Inc 8.00% Series B Cumulative Redeemable Perpetual Preferred Shares"
2641,SB-C,"Safe Bulkers, Inc Cumulative Redeemable Perpetual Preferred Series C (Marshall Islands)"
2642,SB-D,"Safe Bulkers, Inc Perpetual Preferred Series D (Marshall Islands)"
2643,SBGL,Sibanye Gold Limited American Depositary Shares (Each representing four ordinary shares)
2644,SBH,"Sally Beauty Holdings, Inc. (Name to be changed from Sally Holdings, Inc.) Common Stock"
2645,SBNA,Scorpio Tankers Inc. 6.75% Senior Notes due 2020
2646,SBNB,Scorpio Tankers Inc. 7.50% Senior Notes Due 2017
2647,SBR,Sabine Royalty Trust Common Stock
2648,SBS,Companhia de saneamento Basico Do Estado De Sao Paulo
2649,SBW,Western Asset Worldwide Income Fund Inc. Common Stock
2650,SBY,Silver Bay Realty Trust Corp. Common Stock
2651,SC,Santander Consumer USA Holdings Inc. Common Stock
2652,SCCO,Southern Copper Corporation Common Stock
2653,SCD,LMP Capital and Income Fund Inc. Common Stock
2654,SCE-F,Southern California Edison Trust I Trust Preferred Securities
2655,SCE-G,SCE Trust II Trust Preferred Securities
2656,SCE-H,SCE Trust III Fixed/Floating Rate Trust Preference Securities
2657,SCG,SCANA Corporation Common Stock
2658,SCHW,Charles Schwab Corporation (The) Common Stock
2659,SCHW-B,Charles Schwab Corporation Depositary Shares Representing 1/40th Int Sh Non Cumulative Preferred Stock Series B
2660,SCI,Service Corporation International Common Stock
2661,SCL,Stepan Company Common Stock
2662,SCM,Stellus Capital Investment Corporation Common Stock
2663,SCQ,Stellus Capital Investment Corporation 6.50% Notes due 2019
2664,SCS,Steelcase Inc. Common Stock
2665,SCU,Scana Corporation SCANA CORPORATION 2009 Series A 7.70% Enhanced Junior Subordinated Notes
2666,SCX,L.S. Starrett Company (The) Common Stock
2667,SD,Sandridge Energy Inc. Common Stock
2668,SDLP,Seadrill Partners LLC Common Units Representing Limited Liability Company Interests
2669,SDR,SandRidge Mississippian Trust II Common Units representing Beneficial Interests
2670,SDRL,Seadrill Limited Ordinary Shares (Bermuda)
2671,SDT,SandRidge Mississippian Trust I Common Units of Beneficial Interest
2672,SE,Spectra Energy Corp Common Stock
2673,SEAS,"SeaWorld Entertainment, Inc. Common Stock"
2674,SEE,Sealed Air Corporation Common Stock
2675,SEM,Select Medical Holdings Corporation Common Stock
2676,SEMG,Semgroup Corporation Class A Common Stock
2677,SEP,"Spectra Energy Partners, LP Common Units representing Limited Partner Interests"
2678,SERV,"ServiceMaster Global Holdings, Inc. Common Stock"
2679,SF,Stifel Financial Corporation Common Stock
2680,SFB,Stifel Financial Corp. 6.70% Senior Note due 2022
2681,SFE,"Safeguard Scientifics, Inc. New Common Stock"
2682,SFG,"StanCorp Financial Group, Inc. Common Stock"
2683,SFL,Ship Finance International Limited
2684,SFN,Stifel Financial Corporation 5.375% Senior Notes due December 2022
2685,SFS,"Smart & Final Stores, Inc. Common Stock"
2686,SFUN,"SouFun Holdings Limited American Depositary Shares (Each representing Four Class A Ordinary Shares, HK$1.00 par value)"
2687,SFY,Swift Energy Company (Holding Company) Common Stock
2688,SGF,"Aberdeen Singapore Fund, Inc. Common Stock"
2689,SGL,"Strategic Global Income Fund, Inc. Common Stock"
2690,SGM,Stonegate Mortgage Corporation Common Stock
2691,SGU,"Star Gas Partners, L.P. Common Stock"
2692,SGY,Stone Energy Corporation Common Stock
2693,SGZA,"Selective Insurance Group, Inc. 5.875% Senior Notes due 2043"
2694,SHG,Shinhan Financial Group Co Ltd American Depositary Shares
